{"type":"config","name":"config-overhead","metricName":"probe_total","metricUnit":"tokens","bestDirection":"lower"}
{"run":1,"commit":"f422e3e","metric":4016,"metrics":{"probe_requests":1,"append_tokens":103,"package_count":15,"extension_count":6},"status":"keep","description":"baseline: repo @ branch point, live-parity variant","timestamp":1785232981616,"segment":1,"confidence":null,"asi":{"note":"reproduces setup probe exactly (4016); deterministic modulo 1-2 tok cwd line"}}
{"run":2,"commit":"","metric":4016,"metrics":{"probe_requests":1,"append_tokens":103,"package_count":14,"extension_count":6},"status":"discard","description":"attr probe: remove npm:pi-context-usage","timestamp":1785232997597,"segment":1,"confidence":null,"asi":{"hypothesis":"context-usage widget contributes system-prompt/tool overhead; quantify cost","component":"npm:pi-context-usage","overhead_cost":0,"checks":"pass","workload_tokens":"17144","learned":"restored after measurement (attribution pass; keep decisions deferred)"}}
{"run":3,"commit":"","metric":4016,"metrics":{"probe_requests":1,"append_tokens":103,"package_count":14,"extension_count":6},"status":"discard","description":"attr probe: remove npm:@ogulcancelik/pi-model-agents","timestamp":1785233057449,"segment":1,"confidence":null,"asi":{"hypothesis":"model-routing agents pkg; may inject tool schemas","component":"npm:@ogulcancelik/pi-model-agents","overhead_cost":0,"checks":"pass","workload_tokens":"21015","learned":"restored after measurement (attribution pass; keep decisions deferred)"}}
{"run":4,"commit":"","metric":4016,"metrics":{"probe_requests":1,"append_tokens":103,"package_count":14,"extension_count":6},"status":"discard","description":"attr probe: remove npm:@ogulcancelik/pi-model-thinking","timestamp":1785233068758,"segment":1,"confidence":null,"asi":{"hypothesis":"thinking-level control; may inject tools","component":"npm:@ogulcancelik/pi-model-thinking","overhead_cost":0,"checks":"pass","workload_tokens":"21948","learned":"restored after measurement (attribution pass; keep decisions deferred)"}}
{"run":5,"commit":"","metric":4016,"metrics":{"probe_requests":1,"append_tokens":103,"package_count":14,"extension_count":6},"status":"discard","description":"attr probe: remove npm:@plannotator/pi-extension","timestamp":1785233078502,"segment":1,"confidence":null,"asi":{"hypothesis":"plan annotator; likely UI-only zero payload","component":"npm:@plannotator/pi-extension","overhead_cost":0,"checks":"pass","workload_tokens":"18064","learned":"restored after measurement (attribution pass; keep decisions deferred)"}}
{"run":6,"commit":"","metric":4016,"metrics":{"probe_requests":1,"append_tokens":103,"package_count":14,"extension_count":6},"status":"discard","description":"attr probe: remove npm:cc-safety-net","timestamp":1785233088080,"segment":1,"confidence":null,"asi":{"hypothesis":"command guard; likely zero payload","component":"npm:cc-safety-net","overhead_cost":0,"checks":"pass","workload_tokens":"22618","learned":"restored after measurement (attribution pass; keep decisions deferred)"}}
{"run":7,"commit":"","metric":2259,"metrics":{"probe_requests":1,"append_tokens":103,"package_count":14,"extension_count":6},"status":"discard","description":"attr probe: remove npm:context-mode","timestamp":1785233096622,"segment":1,"confidence":null,"asi":{"hypothesis":"ships ctx-* tools; large schema surface expected","component":"npm:context-mode","overhead_cost":1757,"checks":"pass","workload_tokens":"12806","learned":"restored after measurement (attribution pass; keep decisions deferred)"}}
{"run":8,"commit":"","metric":4016,"metrics":{"probe_requests":1,"append_tokens":103,"package_count":14,"extension_count":6},"status":"discard","description":"attr probe: remove npm:pi-autoresearch","timestamp":1785233105856,"segment":1,"confidence":null,"asi":{"hypothesis":"this session's ext; tool schemas expected","component":"npm:pi-autoresearch","overhead_cost":0,"checks":"pass","workload_tokens":"21452","learned":"restored after measurement (attribution pass; keep decisions deferred)"}}
{"run":9,"commit":"","metric":4016,"metrics":{"probe_requests":1,"append_tokens":103,"package_count":14,"extension_count":6},"status":"discard","description":"attr probe: remove npm:pi-cache-graph","timestamp":1785233115061,"segment":1,"confidence":null,"asi":{"hypothesis":"cache analysis; unknown surface","component":"npm:pi-cache-graph","overhead_cost":0,"checks":"pass","workload_tokens":"21232","learned":"restored after measurement (attribution pass; keep decisions deferred)"}}
{"run":10,"commit":"","metric":4014,"metrics":{"probe_requests":1,"append_tokens":103,"package_count":14,"extension_count":6},"status":"discard","description":"attr probe: remove npm:pi-cache-optimizer","timestamp":1785233140176,"segment":1,"confidence":null,"asi":{"hypothesis":"cache tuning; likely zero payload","component":"npm:pi-cache-optimizer","overhead_cost":2,"checks":"pass","workload_tokens":"21124","learned":"restored after measurement (attribution pass; keep decisions deferred)"}}
{"run":11,"commit":"","metric":4016,"metrics":{"probe_requests":1,"append_tokens":103,"package_count":14,"extension_count":6},"status":"discard","description":"attr probe: remove npm:pi-continue","timestamp":1785233149537,"segment":1,"confidence":null,"asi":{"hypothesis":"session resume; likely zero payload","component":"npm:pi-continue","overhead_cost":0,"checks":"pass","workload_tokens":"18602","learned":"restored after measurement (attribution pass; keep decisions deferred)"}}
{"run":12,"commit":"","metric":4016,"metrics":{"probe_requests":1,"append_tokens":103,"package_count":14,"extension_count":6},"status":"discard","description":"attr probe: remove npm:pi-herdr-btw","timestamp":1785233158481,"segment":1,"confidence":null,"asi":{"hypothesis":"herd-between; unknown surface","component":"npm:pi-herdr-btw","overhead_cost":0,"checks":"pass","workload_tokens":"17120","learned":"restored after measurement (attribution pass; keep decisions deferred)"}}
{"run":13,"commit":"","metric":3400,"metrics":{"probe_requests":1,"append_tokens":103,"package_count":14,"extension_count":6},"status":"discard","description":"attr probe: remove npm:pi-lean-ctx","timestamp":1785233166271,"segment":1,"confidence":null,"asi":{"hypothesis":"lean-ctx bridge replace-mode; expect large delta","component":"npm:pi-lean-ctx","overhead_cost":616,"checks":"pass","workload_tokens":"10509","learned":"restored after measurement (attribution pass; keep decisions deferred)"}}
{"run":14,"commit":"","metric":4339,"metrics":{"probe_requests":1,"append_tokens":103,"package_count":14,"extension_count":6},"status":"discard","description":"attr probe: remove npm:pi-slim","timestamp":1785233175401,"segment":1,"confidence":null,"asi":{"hypothesis":"slim prompt; unknown","component":"npm:pi-slim","overhead_cost":-323,"checks":"pass","workload_tokens":"22737","learned":"restored after measurement (attribution pass; keep decisions deferred)"}}
{"run":15,"commit":"","metric":10483,"metrics":{"probe_requests":1,"append_tokens":103,"package_count":14,"extension_count":6},"status":"discard","description":"attr probe: remove npm:pi-tscg","timestamp":1785233187436,"segment":1,"confidence":null,"asi":{"hypothesis":"PROBE ONLY (off-limits for real removal): quantifies tscg schema-compression savings","component":"npm:pi-tscg","overhead_cost":-6467,"checks":"pass","workload_tokens":"42732","learned":"restored after measurement (attribution pass; keep decisions deferred)"}}
{"run":16,"commit":"","metric":3389,"metrics":{"probe_requests":1,"append_tokens":103,"package_count":14,"extension_count":6},"status":"discard","description":"attr probe: remove npm:@quintinshaw/pi-dynamic-workflows","timestamp":1785233196593,"segment":1,"confidence":null,"asi":{"hypothesis":"workflow tool; schema surface expected","component":"npm:@quintinshaw/pi-dynamic-workflows","overhead_cost":627,"checks":"pass","workload_tokens":"16040","learned":"restored after measurement (attribution pass; keep decisions deferred)"}}
{"run":17,"commit":"","metric":4016,"metrics":{"probe_requests":1,"append_tokens":103,"package_count":15,"extension_count":6},"status":"discard","description":"attr probe: remove /home/alex/.pi/agent/npm/node_modules/@samfp/pi-essentials/src/auto-session-name.ts","timestamp":1785233222726,"segment":1,"confidence":null,"asi":{"hypothesis":"UI-only; zero payload","component":"/home/alex/.pi/agent/npm/node_modules/@samfp/pi-essentials/src/auto-session-name.ts","overhead_cost":0,"checks":"pass","workload_tokens":"16798","learned":"restored after measurement (attribution pass; keep decisions deferred)"}}
{"run":18,"commit":"","metric":4016,"metrics":{"probe_requests":1,"append_tokens":103,"package_count":15,"extension_count":6},"status":"discard","description":"attr probe: remove /home/alex/.pi/agent/npm/node_modules/@samfp/pi-essentials/src/auto-title.ts","timestamp":1785233231193,"segment":1,"confidence":null,"asi":{"hypothesis":"UI-only; zero payload","component":"/home/alex/.pi/agent/npm/node_modules/@samfp/pi-essentials/src/auto-title.ts","overhead_cost":0,"checks":"pass","workload_tokens":"17123","learned":"restored after measurement (attribution pass; keep decisions deferred)"}}
{"run":19,"commit":"","metric":4016,"metrics":{"probe_requests":1,"append_tokens":103,"package_count":15,"extension_count":6},"status":"discard","description":"attr probe: remove /home/alex/.pi/agent/npm/node_modules/@samfp/pi-essentials/src/clipboard-image.ts","timestamp":1785233240272,"segment":1,"confidence":null,"asi":{"hypothesis":"UI-only; zero payload","component":"/home/alex/.pi/agent/npm/node_modules/@samfp/pi-essentials/src/clipboard-image.ts","overhead_cost":0,"checks":"pass","workload_tokens":"21694","learned":"restored after measurement (attribution pass; keep decisions deferred)"}}
{"run":20,"commit":"","metric":4016,"metrics":{"probe_requests":1,"append_tokens":103,"package_count":15,"extension_count":6},"status":"discard","description":"attr probe: remove /home/alex/.pi/agent/npm/node_modules/@samfp/pi-essentials/src/compact-header.ts","timestamp":1785233248900,"segment":1,"confidence":null,"asi":{"hypothesis":"UI-only; zero payload","component":"/home/alex/.pi/agent/npm/node_modules/@samfp/pi-essentials/src/compact-header.ts","overhead_cost":0,"checks":"pass","workload_tokens":"18006","learned":"restored after measurement (attribution pass; keep decisions deferred)"}}
{"run":21,"commit":"","metric":4016,"metrics":{"probe_requests":1,"append_tokens":103,"package_count":15,"extension_count":6},"status":"discard","description":"attr probe: remove /home/alex/.pi/agent/npm/node_modules/@samfp/pi-essentials/src/image-context-pruner.ts","timestamp":1785233257907,"segment":1,"confidence":null,"asi":{"hypothesis":"context pruner; may inject text","component":"/home/alex/.pi/agent/npm/node_modules/@samfp/pi-essentials/src/image-context-pruner.ts","overhead_cost":0,"checks":"pass","workload_tokens":"17546","learned":"restored after measurement (attribution pass; keep decisions deferred)"}}
{"run":22,"commit":"","metric":4016,"metrics":{"probe_requests":1,"append_tokens":103,"package_count":15,"extension_count":6},"status":"discard","description":"attr probe: remove /home/alex/.pi/agent/npm/node_modules/@samfp/pi-essentials/src/markdown-viewer.ts","timestamp":1785233266435,"segment":1,"confidence":null,"asi":{"hypothesis":"UI-only; zero payload","component":"/home/alex/.pi/agent/npm/node_modules/@samfp/pi-essentials/src/markdown-viewer.ts","overhead_cost":0,"checks":"pass","workload_tokens":"16949","learned":"restored after measurement (attribution pass; keep decisions deferred)"}}
{"run":23,"commit":"","metric":1588,"metrics":{"probe_requests":1,"append_tokens":103,"package_count":13,"extension_count":6},"status":"discard","description":"attr probe: remove npm:context-mode npm:pi-lean-ctx","timestamp":1785233330693,"segment":1,"confidence":null,"asi":{"hypothesis":"duplication test: if lean-ctx bridge re-ships ctx-* schemas, combined cost < sum(1757+616)","component":"npm:context-mode npm:pi-lean-ctx","overhead_cost":2428,"checks":"pass","workload_tokens":"11314","learned":"restored after measurement (attribution pass; keep decisions deferred)"}}
{"run":24,"commit":"","metric":4016,"metrics":{"probe_requests":1,"append_tokens":103,"package_count":15,"extension_count":6},"status":"discard","description":"structural probe: skills-only-ce-lite","timestamp":1785233458643,"segment":1,"confidence":null,"asi":{"hypothesis":"skill metadata may be injected into system prompt; if delta=0 skills are fully lazy and out of scope","component":"skills-only-ce-lite","delta_vs_baseline":0,"checks":"pass","workload_tokens":"21690","learned":"restored after measurement (structural probe)"}}
{"run":25,"commit":"","metric":4016,"metrics":{"probe_requests":1,"append_tokens":103,"package_count":15,"extension_count":6},"status":"discard","description":"structural probe: thinking-minimal","timestamp":1785233468994,"segment":1,"confidence":null,"asi":{"hypothesis":"quantify only; thinking is a quality lever, likely restore","component":"thinking-minimal","delta_vs_baseline":0,"checks":"pass","workload_tokens":"20883","learned":"restored after measurement (structural probe)"}}
{"run":26,"commit":"","metric":3923,"metrics":{"probe_requests":1,"append_tokens":0,"package_count":15,"extension_count":6},"status":"discard","description":"structural probe: overlay-empty","timestamp":1785233478468,"segment":1,"confidence":null,"asi":{"hypothesis":"quantify exact overlay cost (expected ~103 tok)","component":"overlay-empty","delta_vs_baseline":-93,"checks":"pass","workload_tokens":"16581","learned":"restored after measurement (structural probe)"}}
{"run":27,"commit":"f0fca10","metric":4007,"metrics":{"probe_requests":1,"append_tokens":90,"package_count":15,"extension_count":6},"status":"keep","description":"tighten APPEND_SYSTEM.md overlay (semantics preserved per diff)","timestamp":1785233632009,"segment":1,"confidence":null,"asi":{"hypothesis":"overlay wording compressible without doctrine loss","learned":"-9 tok vs baseline, reproducible on re-run, checks green; directives/pattern-list/skill-path all preserved in diff"}}
