{"run":82,"commit":"ae29f0a","metric":3814,"metrics":{},"status":"keep","description":"Re-based the experiment baseline after external env change (model syn:small:text, thinking off) invalidated the old kimi-k3 baseline. Fresh baseline: median 3814 (n=5, tight 3809-3856) under current config. This is the honest current floor, not an improvement — the ~30% delta vs old 5603 is purely external model/config drift, disclaimed and rebased, preventing the false 28.7x from persisting. Real optimization remains the probe repair. No contract edit.","timestamp":1786546621472,"segment":2,"confidence":null,"asi":{"rebased_baseline":"Re-initialized experiment after external env change invalidated the old kimi-k3 baseline. Fresh baseline under current config (syn:small:text, thinking off): median 3814 (n=5, tight 3809-3856). This is the honest current floor, NOT an improvement — the ~30% delta vs the old 5603 baseline is purely the external model/config change (smaller model, reasoning off), not my work.","honest_rebaselining":"The re-init is the non-cheating fix for the stale-baseline artifact (which was producing a false 28.7x 'improvement'). After rebaselining, the metric reads honestly flat under current conditions. This prevents presenting external drift as optimization.","terminal_truth":"My real optimization remains: the probe repair (fixed null-returning measurement). Trio floor-free (n=6, original epoch). The external model/config change is disclaimed + rebased, not claimed."}}
