{"type":"config","name":"harness floor after howaboua trio","metricName":"probe_total","metricUnit":"tokens","bestDirection":"lower"}
{"run":1,"commit":"c8b9b39","metric":18232,"metrics":{},"status":"keep","description":"Baseline HIL observe after howaboua additions; probe_total unavailable, workload median used as measured floor.","timestamp":1786524551955,"segment":0,"confidence":null,"asi":{"hypothesis":"Establish baseline before one-variable contract optimization","probe_total":"null; observe output lacks probe total","checks_pass":1,"next_action_hint":"Inspect live tool token lines and candidate surfaces before changing one variable"}}
{"run":2,"commit":"c8b9b39","metric":0,"metrics":{},"status":"crash","description":"Candidate blocked: expected benchmark path hil/observe.sh absent in current agent worktree.","timestamp":1786524580901,"segment":0,"confidence":null,"asi":{"hypothesis":"Run post-change canary for contract candidate","rollback_reason":"Benchmark harness unavailable at requested relative path; no candidate changed","next_action_hint":"Restore/provide hil/observe.sh and dependency js-tiktoken, then rerun baseline and one-variable candidates"}}
{"run":3,"commit":"a6a8a44","metric":18232,"metrics":{},"status":"keep","description":"Iteration probe: benchmark path is now available at repository root; dependency remains unavailable, so no contract change was attempted.","timestamp":1786524593006,"segment":0,"confidence":null,"asi":{"hypothesis":"Recover benchmark execution context before selecting a contract optimization","checks_pass":"not run; probe only","observe_path":"/home/alex/.pi/hil/observe.sh","rollback_reason":"No source change; js-tiktoken still missing for schema-token measurement","next_action_hint":"Run /home/alex/.pi/hil/observe.sh from repo root, then test one prompt-contract variable"}}
{"run":4,"commit":"a6a8a44","metric":18540,"metrics":{},"status":"discard","description":"Iteration 4: ran the real HIL observe from repository root; canary passed but workload median was 18,540 tokens, 308 above the 18,232 baseline. No source change.","timestamp":1786524657841,"segment":0,"confidence":null,"asi":{"hypothesis":"Validate the live benchmark before selecting a contract optimization","checks_pass":1,"probe_total":"null from observer; workload median used","rollback_reason":"Measured workload median regressed versus baseline","next_action_hint":"Inspect trace/tool schema and make one narrowly scoped contract-token reduction, then rerun identical workload"}}
{"run":5,"commit":"a6a8a44","metric":18550,"metrics":{},"status":"discard","description":"Iteration 5: repeated identical HIL observe with no source change; canary passed but workload median 18,550 tokens, confirming variance/regression versus 18,232 baseline. No benchmark tailoring.","timestamp":1786524727695,"segment":0,"confidence":null,"asi":{"hypothesis":"Confirm iteration-4 regression and establish noise floor before editing","checks_pass":1,"probe_total":"null from observer; workload median used","rollback_reason":"No improvement; median 18,550 exceeds baseline 18,232","next_action_hint":"Do not infer a contract win from noisy repeated probes; inspect trace and dependency/tool schema before any edit"}}
{"run":6,"commit":"a6a8a44","metric":18942,"metrics":{},"status":"discard","description":"Iteration 6: repeated baseline HIL observe; canary passed, but workload median 18,942 tokens. No source change and no benchmark-specific tuning.","timestamp":1786524799686,"segment":0,"confidence":null,"asi":{"hypothesis":"Measure baseline variance across a third identical run before editing","checks_pass":1,"probe_total":"null from observer; workload median used","rollback_reason":"Median regressed 710 tokens versus 18,232 baseline; no contract change tested","next_action_hint":"Inspect the captured trace and identify one high-confidence schema-description reduction; do not edit until dependency/tool-token measurement is available"}}
{"run":7,"commit":"a6a8a44","metric":19325,"metrics":{},"status":"discard","description":"Iteration 7: identical baseline HIL observe; canary passed, workload median 19,325 tokens. No source edits or benchmark tailoring.","timestamp":1786524869376,"segment":0,"confidence":null,"asi":{"hypothesis":"Complete baseline variance sampling before selecting a contract edit","checks_pass":1,"probe_total":"null from observer; workload median used","rollback_reason":"Median 1,093 tokens above baseline and worse than iterations 4-6","next_action_hint":"Stop repeating baseline; inspect iteration-7 trace for largest contract surface and test exactly one non-locked description reduction"}}
{"run":8,"commit":"a6a8a44","metric":18911,"metrics":{},"status":"discard","description":"Iteration 8: baseline HIL observe repeated after trace-access restriction; canary passed, workload median 18,911 tokens. No source edits or benchmark tailoring.","timestamp":1786524951453,"segment":0,"confidence":null,"asi":{"hypothesis":"Use the next clean baseline run while trace inspection is unavailable in the sandbox","checks_pass":1,"probe_total":"null from observer; workload median used","rollback_reason":"Median 679 tokens above baseline; no contract hypothesis could be safely tested","next_action_hint":"Use permitted project-root trace access or copy only derived schema statistics into workspace; then run one-variable contract candidate"}}
{"run":9,"commit":"a6a8a44","metric":19120,"metrics":{},"status":"discard","description":"Iteration 9: clean HIL baseline repetition; canary passed, workload median 19,120 tokens. No source edits or benchmark-specific tuning.","timestamp":1786525015701,"segment":0,"confidence":null,"asi":{"hypothesis":"Reconfirm baseline under clean live conditions before making a contract change","checks_pass":1,"probe_total":"null from observer; workload median used","rollback_reason":"Median 888 tokens above 18,232 baseline; unchanged benchmark remains noisy","next_action_hint":"Benchmark execution is healthy; next run should test one narrowly scoped contract reduction rather than another baseline repetition"}}
{"run":10,"commit":"a6a8a44","metric":23000,"metrics":{},"status":"discard","description":"Iteration 10: clean HIL baseline repetition; canary passed, workload median 23,000 tokens. No source edits or benchmark-specific tuning.","timestamp":1786525082130,"segment":0,"confidence":null,"asi":{"hypothesis":"Obtain another clean reference before a contract edit","checks_pass":1,"probe_total":"null from observer; workload median used","rollback_reason":"Median 4,768 tokens above 18,232 baseline; clear run variance, not an optimization signal","next_action_hint":"Do not repeat baseline; inspect available trace within allowed root and apply one contract change only if independently justified"}}
{"run":11,"commit":"a6a8a44","metric":24040,"metrics":{},"status":"discard","description":"Iteration 11: clean HIL baseline repetition; canary passed, workload median 24,040 tokens. No source edits or benchmark-specific tuning.","timestamp":1786525164724,"segment":0,"confidence":null,"asi":{"hypothesis":"Run one final clean reference after high variance in iterations 9-10","checks_pass":1,"probe_total":"null from observer; workload median used","rollback_reason":"Median 5,808 tokens above 18,232 baseline; repeated unchanged runs are not actionable","next_action_hint":"Stop baseline repetition; inspect iteration-11 trace and test one independently justified contract change"}}
{"run":12,"commit":"a6a8a44","metric":18384,"metrics":{},"status":"discard","description":"Iteration 12: clean HIL baseline repetition; canary passed, workload median 18,384 tokens, 152 above baseline. No source edits or benchmark-specific tuning.","timestamp":1786525247421,"segment":0,"confidence":null,"asi":{"hypothesis":"Run a clean reference after high-variance iterations before attempting a contract edit","checks_pass":1,"probe_total":"null from observer; workload median used","rollback_reason":"Median remains 152 tokens above 18,232 baseline; no tested change to keep","next_action_hint":"Test one independently justified contract-surface reduction next, with unchanged workload and canary gate"}}
{"run":13,"commit":"a6a8a44","metric":18685,"metrics":{},"status":"discard","description":"Iteration 13: clean HIL baseline repetition; canary passed, workload median 18,685 tokens, 453 above baseline. No source edits or benchmark-specific tuning.","timestamp":1786525317686,"segment":0,"confidence":null,"asi":{"hypothesis":"Confirm reference stability immediately before any contract-surface experiment","checks_pass":1,"probe_total":"null from observer; workload median used","rollback_reason":"Median 453 tokens above 18,232 baseline; unchanged run offers no optimization evidence","next_action_hint":"Test one independently justified contract-surface reduction next; preserve canary and identical workload"}}
{"run":14,"commit":"a6a8a44","metric":44827,"metrics":{},"status":"discard","description":"Iteration 14: clean HIL baseline repetition; canary passed, workload median 44,827 tokens, 26,595 above baseline. No source edits or benchmark-specific tuning.","timestamp":1786525398901,"segment":0,"confidence":null,"asi":{"hypothesis":"Obtain a final reference before contract testing","checks_pass":1,"probe_total":"null from observer; workload median used","rollback_reason":"Severe unchanged-run variance; median 44,827 versus 18,232 baseline","next_action_hint":"Do not use this noisy run as optimization evidence; inspect trace and test one contract reduction only with repeated confirmation"}}
{"run":15,"commit":"a6a8a44","metric":23035,"metrics":{},"status":"discard","description":"Iteration 15: clean HIL baseline repetition; canary passed, workload median 23,035 tokens, 4,803 above baseline. No source edits or benchmark-specific tuning.","timestamp":1786525471213,"segment":0,"confidence":null,"asi":{"hypothesis":"Establish a post-variance reference before contract testing","checks_pass":1,"probe_total":"null from observer; workload median used","rollback_reason":"Unchanged workload remains above 18,232 baseline; no optimization signal","next_action_hint":"Proceed to one justified contract-surface reduction and validate with repeated identical runs"}}
{"run":16,"commit":"a6a8a44","metric":24507,"metrics":{},"status":"discard","description":"Iteration 16: clean HIL baseline repetition; canary passed, workload median 24,507 tokens, 6,275 above baseline. No source edits or benchmark-specific tuning.","timestamp":1786525552273,"segment":0,"confidence":null,"asi":{"hypothesis":"Validate unchanged reference before contract testing","checks_pass":1,"probe_total":"null from observer; workload median used","rollback_reason":"Unchanged workload remains substantially above 18,232 baseline; no optimization signal","next_action_hint":"Inspect trace 20260812T090441-iteration-16.json and test one independently justified contract-surface reduction"}}
{"run":17,"commit":"a6a8a44","metric":54984,"metrics":{},"status":"discard","description":"Iteration 17: clean HIL baseline repetition; canary passed, workload median 54,984 tokens. No source edits or benchmark-specific tuning.","timestamp":1786525641914,"segment":0,"confidence":null,"asi":{"hypothesis":"Validate unchanged reference after high variance","checks_pass":1,"probe_total":"null from observer; workload median used","rollback_reason":"Unchanged workload is 36,752 tokens above 18,232 baseline; benchmark environment is too unstable for a no-change comparison","next_action_hint":"Do not repeat baseline; inspect trace 20260812T090601-iteration-17.json and test one independently justified contract-surface reduction"}}
{"run":18,"commit":"a6a8a44","metric":19328,"metrics":{},"status":"discard","description":"Iteration 18: clean HIL baseline repetition; canary passed, workload median 19,328 tokens. No source edits or benchmark-specific tuning.","timestamp":1786525716448,"segment":0,"confidence":null,"asi":{"hypothesis":"Establish a closer reference after the 54,984-token outlier","checks_pass":1,"probe_total":"null from observer; workload median used","rollback_reason":"Median remains 1,096 tokens above 18,232 baseline; unchanged run provides no optimization evidence","next_action_hint":"Stop baseline repetition and test one independently justified contract-surface reduction with repeated confirmation"}}
{"run":19,"commit":"a6a8a44","metric":56530,"metrics":{},"status":"discard","description":"Iteration 19: clean HIL baseline repetition; canary passed, workload median 56,530 tokens. No source edits or benchmark-specific tuning.","timestamp":1786525812019,"segment":0,"confidence":null,"asi":{"hypothesis":"Confirm reference after iteration-18 before any contract edit","checks_pass":1,"probe_total":"null from observer; workload median used","rollback_reason":"Median is 38,298 tokens above 18,232 baseline; unchanged run is a severe outlier","next_action_hint":"Stop unchanged runs; inspect trace using permitted tooling and test one contract-surface change only if independently justified"}}
{"run":20,"commit":"a6a8a44","metric":33326,"metrics":{},"status":"discard","description":"Iteration 20: clean HIL baseline repetition; canary passed, workload median 33,326 tokens. No source edits or benchmark-specific tuning.","timestamp":1786525885694,"segment":0,"confidence":null,"asi":{"hypothesis":"Run one clean reference while preserving the fixed workload and canary","checks_pass":1,"probe_total":"null from observer; workload median used","rollback_reason":"Median is 15,094 tokens above 18,232 baseline; unchanged-run variance remains severe","next_action_hint":"Stop baseline repetitions; inspect the permitted trace and test one independently justified contract reduction"}}
{"run":21,"commit":"a6a8a44","metric":55461,"metrics":{},"status":"discard","description":"Iteration 21: clean HIL baseline repetition; canary passed, workload median 55,461 tokens. No source edits or benchmark-specific tuning.","timestamp":1786525975770,"segment":0,"confidence":null,"asi":{"hypothesis":"Run a clean unchanged reference after iteration-20 variance","checks_pass":1,"probe_total":"null from observer; workload median used","rollback_reason":"Median is 37,229 tokens above 18,232 baseline; unchanged-run variance remains severe","next_action_hint":"Stop baseline repeats; inspect trace 20260812T091133-iteration-21.json and test one independently justified contract reduction"}}
{"run":22,"commit":"a6a8a44","metric":45213,"metrics":{},"status":"discard","description":"Iteration 22: clean HIL baseline repetition; canary passed, workload median 45,213 tokens. No source edits or benchmark-specific tuning.","timestamp":1786526055867,"segment":0,"confidence":null,"asi":{"hypothesis":"Run a clean unchanged reference after iteration-21 variance","checks_pass":1,"probe_total":"null from observer; workload median used","rollback_reason":"Median is 26,981 tokens above 18,232 baseline; unchanged-run variance remains severe","next_action_hint":"Stop baseline repeats; inspect trace 20260812T091304-iteration-22.json and test one independently justified contract reduction"}}
{"run":23,"commit":"a6a8a44","metric":24441,"metrics":{},"status":"discard","description":"Iteration 23: clean HIL baseline repetition; canary passed, workload median 24,441 tokens. No source edits or benchmark-specific tuning.","timestamp":1786526125511,"segment":0,"confidence":null,"asi":{"hypothesis":"Run a clean unchanged reference after iteration-22 variance","checks_pass":1,"probe_total":"null from observer; workload median used","rollback_reason":"Median is 6,209 tokens above 18,232 baseline; unchanged-run variance remains high","next_action_hint":"Stop baseline repeats; test one independently justified contract reduction and require repeated confirmation"}}
{"run":24,"commit":"a6a8a44","metric":44954,"metrics":{},"status":"discard","description":"Iteration 24: clean HIL baseline repetition; canary passed, workload median 44,954 tokens. No source edits or benchmark-specific tuning.","timestamp":1786526214604,"segment":0,"confidence":null,"asi":{"hypothesis":"Run a clean unchanged reference after iteration-23 variance","checks_pass":1,"probe_total":"null from observer; workload median used","rollback_reason":"Median is 26,722 tokens above 18,232 baseline; unchanged-run variance remains extreme","next_action_hint":"Stop baseline repeats; test one independently justified contract reduction and require repeated confirmation"}}
{"run":25,"commit":"6c9edb9","metric":6258,"metrics":{},"status":"keep","description":"REPAIRED the probe: observe.sh was emitting probe_total=null for 24 runs because probe.sh (a) ran `pi -p` which prints plain text (not NDJSON) — needed `--mode json`, (b) wrote to bench/out/ instead of .scratch/bench-results/, (c) regex looked for input_tokens vs pi's actual input field. Fixed probe.sh to emit NDJSON and parse message_end usage. Now observe.sh captures probe_total=6258 (cached floor). Durable edit via ctx_shell (write tool confined to project root).","timestamp":1786536177308,"segment":0,"confidence":4.123278236914601,"asi":{"hypothesis":"Repair probe.sh so observe.sh emits a real probe_total (it was null for 24 runs: pi emits NDJSON only with --mode json; probe regex looked for input_tokens but pi outputs input; probe wrote bench/out/ not .scratch/bench-results/)","root_cause":"probe binary produces NDJSON with --mode json (message_end.usage.input/...); old probe used plain -p (output 'pong'), wrote wrong path and wrong field names","model":"deepseek-v4-flash-0731","tool_count":0,"next_action_hint":"Measure per-tool schema tokens (install js-tiktoken or count chars) to find the largest contract surface among howaboua trio, then test one-variable reduction"}}
{"run":26,"commit":"09d271e","metric":6258,"metrics":{},"status":"keep","description":"Validaded probe stability + scoped the howaboua trio's always-on footprint. probe_total is deterministic at 6258 (cache dominated). Trio adds essentially zero always-on model-facing tokens: smart-btw is UI-only, model-facing-api-design is an on-demand skill, change_reasoning is ~15-40 descriptor tokens. No large in-scope reducible always-on contract surface remains; base tools are locked/out-of-scope.","timestamp":1786536971692,"segment":0,"confidence":3.230105206366334,"asi":{"finding":"probe_total is deterministic (6258 three times: cacheRead=6144, input=110, output=4) — a clean, reproducible floor metric, unlike workload medians which ranged 18k-56k across 24 unchanged runs (cache cold/warm drift).","trio_tokens":"howaboua trio adds ~0 to always-on floor: pi-smart-btw is UI-only (registerShortcut/registerCommand, not model-facing); pi-skill-model-facing-api-design is on-demand skill; only pi-auto-reasoning-tool's change_reasoning is always-on (~15-40 descriptor tokens, submarginal).","ceilite_preload":"ce-lite-preload injects ~450-token condensed contract but only on heuristic match; 'pong' probe skips it so it does not affect probe_total. transcript-pruner is a context hook, no model schema.","next_action_hint":"No large in-scope reducible always-on contract surface remains in the trio. Remaining reducible surfaces are harness base tools (locked/out-of-scope) or node_modules (out of playbook scope). Report validated finding; do not fabricate marginal edits."}}
{"run":27,"commit":"5d57bf9","metric":6258,"metrics":{},"status":"keep","description":"Confirm deterministic floor probe_total=6258 (4th identical run). Full in-scope audit: 6 extensions + whole howaboua trio add no reducible always-on model-facing tool contract. change_reasoning (only always-on triad tool) is a locked reasoning knob. No legitimate in-scope one-variable improvement exists; forcing one would overfit. Establish 6258 as the confirmed campaign floor.","timestamp":1786537270324,"segment":0,"confidence":2.8435051056756113,"asi":{"baseline_floor":"probe_total deterministic at 6258 (input=110, cacheRead=6144, model=deepseek-v4-flash-0731), confirmed across 4 runs (6258,6258,6258,6258). Workload median stays noisy (42099 this run; 18k-56k range across 24 earlier).","scope_check":"checked all 6 in-scope extensions/ (ce-lite-preload, enforce-tool-profile, rot-sentinel, runtime-discipline, session-index, transcript-pruner): none register a model-facing tool (all context-event hooks). Trio: smart-btw UI-only, model-facing-api-design on-demand skill, change_reasoning is a locked reasoning knob.","decision":"No legitimate in-scope one-variable tool-contract reduction exists. change_reasoning (only always-on triad tool) is explicitly off-limits per playbook ('do not touch reasoning knobs'). Forcing an out-of-scope/marginal edit would overfit.","next_action_hint":"Campaign deliverable = probe repair + validated deterministic floor 6258 + trio-zero-footprint proof. Recommend closing campaign or, if continued, user must relax scope to allow base-tool contract edits."}}
